id,pregunta
[0],NameError en un bot de Discord
[1],java.lang.NullPointerException | Android studio
[2],Como actualizo el salario de un empleado con el salario de otro empleado dentro de la misma tabla?
[3],¿Cómo hacer binding en WPF entre dos tablas mediante una FK de una tabla intermedia?
[4],Ayuda en XML sql server no deja poner null en datetime
[5],¿Para qué sirve la clase Presentation al momento de crear una instancia de un formulario?
[6],¿Por qué pierde la conexión de base de datos mi router?
[7],carrera de relevos hacer que se mueva la imagen simulando unaen un carril carrera de 5 personas
[8],java.lang.IllegalStateException: Location is not set
[9],Error con el breack en python
[10],Estadísticas del coronavirus para mi estado
[11],"Estoy atorado con un error de importacion en python, no puedo usar graphAPI de facebook"
[12],Generar un JSON a partir de datos Excel en VBA
[13],¿Cómo se hacen los separadores de la siguiente imagen en VS 2019?
[14],Convertir filas dinámicas a columnas en SQL Server 2012
[15],Denegar logeo en phpMyAdmin
[16],Deshabilitar boton al no seleccionar uno de dos input checkbox
[17],"En NodeJs, ¿Cuándo usar las plantillas HTML (como pug o ejs) y cuándo usar el middleware con la carpeta de Static Files?"
[18],React no inicia al iniciar docker
[19],Split de una cadena..shell
[20],¿Como juntar archivos mp4 y wav en uno solo?
[21],invalid index to scalar variable
[22],hdfs dfs -put carpeta/archivo.json. No encuentra el archivo
[23],While siempre hace break
[24],Error al crear gráfico. AttributeError: 'DataFrame' object has no attribute 'bar'
[25],"¿Como detectar si un input está seleccionado completamente en el evento onfocus con javascripts, para validar decimales?"
[26],Error Message: mysqli::real_connect(): (HY000/2002) al conectar codeigniter con base de datos en servidor remota
[27],Obtener la hora dependiendo del timezone en PHP
[28],descargar archivos a la maquina objetivo en python
[29],Cómo imprimo un vector al lado de una matriz? En C
[30],"¿Alguna manera de utulizar variable que se ubica abajo, para una condicional primera?"
[31],Error - Could not determine kind of name for C.Free - Golang
[32],Query en DB2 con group by & having count: veces que se repite un teléfono en un listado excluyendo repeticiones en personas repetidas
[33],¿Cómo puedo hacer un hola mundo en Java que demuestre que sé programación asíncrona?
[34],Cuando realizo la siguiente instrucción en consola y no se ejecuta: rails s -e test -p 300
[35],Pedir permiso de administrador con Python 3
[36],Cannot read property 'haDesignada' of undefined en recorrido de un for mas grande que el array
[37],se muestran datos duplicados en mysql
[38],Como saco el paquete de movimiento de un juego?
[39],Hacer que una promesa regrese algo para seguir trabajando en código síncrono
[40],sdvsd<vasdfsdfsdfsdafsadfsadfsadf
[41],Correr mi app de vue cli desde el index.html
[42],Como puedo cambiar el nombre de authentication and authorization en django-admin
[43],EJS error en <%- cuando uso import
[44],error para Call to a member function bindParam() on boolean
[45],¿como subir imagen a la base de datos mysql con php?
[46],REGISTRAR CLIENTE
[47],Cuales son la diferentes maneras de conectar c# a base de datos aparte de oracle [cerrada]
[48],Obtener Token Claims - Net Core
[49],Laravel x7 base de no encontrada 'laravel'
